Food Name,Country of Origin,Rarity,Description
Pizza,Italy,1,A savory dish of Italian origin, consisting of a usually round, flattened base of leavened wheat-based dough topped with tomatoes, cheese, and often various other ingredients.
Sushi,Japan,1,A Japanese dish of prepared vinegared rice, usually with some sugar and salt, accompanying a variety of ingredients, such as seafood, vegetables, and occasionally tropical fruits.
Taco,Mexico,1,A traditional Mexican dish consisting of a small hand-sized corn or wheat tortilla topped with a filling.
Curry,India,1,A variety of dishes originating in the Indian subcontinent that use a complex combination of spices or herbs, usually including ground turmeric, cumin, coriander, ginger, and fresh or dried chilies.
Ramen,Japan,1,A Japanese noodle soup dish. It consists of Chinese-style wheat noodles served in a meat or (occasionally) fish-based broth, often flavored with soy sauce or miso, and uses toppings such as sliced pork, nori, menma, and scallions.
Paella,Spain,2,A Spanish rice dish originally from Valencia. It is one of the best-known dishes in Spanish cuisine.
Hamburger,United States,1,A sandwich consisting of one or more cooked patties of ground meat, usually beef, placed inside a sliced bread roll or bun.
Pho,Vietnam,2,A Vietnamese soup consisting of broth, rice noodles, herbs, and meat, usually beef or chicken.
Croissant,France,1,A buttery, flaky, viennoiserie pastry of Austrian origin, named for its historical crescent shape.
Kebab,Turkey,1,A variety of cooked meat dishes, with their origins in Middle Eastern cuisine.
Fish and Chips,United Kingdom,1,A hot dish consisting of fried battered fish and hot chips. It is a common take-away food in the United Kingdom and numerous other countries, particularly in English-speaking and Commonwealth nations.
Dim Sum,China,1,A large range of small dishes that Cantonese people traditionally enjoy in restaurants for breakfast and lunch.
Goulash,Hungary,2,A soup or stew of meat and vegetables seasoned with paprika and other spices. Originating in medieval Hungary, goulash is a popular meal predominantly eaten in Central Europe but also in other parts of Europe.
Poutine,Canada,2,A dish of french fries and cheese curds topped with a brown gravy. It emerged in Quebec, Canada, in the late 1950s in the Centre-du-Québec region.
Pad Thai,Thailand,1,A stir-fried rice noodle dish commonly served as a street food and at most restaurants in Thailand as part of the country's cuisine.
Moussaka,Greece,2,"An eggplant- and/or potato-based dish, often including ground meat, which is common in the Balkans and the Middle East, with many local and regional variations."
Empanada,Argentina,2,"A type of baked or fried turnover consisting of pastry and filling, common in Southern European, Latin American, and the Philippines cultures."
Borscht,Ukraine,2,"A sour soup common in Eastern Europe and Northern Asia. In English, the word 'borscht' is most often associated with the soup's variant of Ukrainian origin, made with beetroots as one of the main ingredients, which give the dish its distinctive red color."
Ceviche,Peru,2,"A South American seafood dish that originated in Peru, typically made from fresh raw fish cured in fresh citrus juices, most commonly lemon or lime, and spiced with ají, chili peppers or other seasonings including chopped onions, salt, and coriander."
Jollof Rice,Nigeria,2,"A rice dish from West Africa. The dish is typically made with long-grain rice, tomatoes, onions, spices, vegetables and meat in a single pot, although its ingredients and preparation methods vary across different regions."
Feijoada,Brazil,2,A stew of beans with beef and pork. It is the national dish of Brazil.
Pierogi,Poland,2,"Filled dumplings made by wrapping unleavened dough around a savory or sweet filling and cooking in boiling water, or pan-frying. They are associated with the cuisines of Central, Eastern and Southeastern Europe."
Lasagna,Italy,1,"A type of wide, flat pasta, possibly one of the oldest types of pasta. It is an Italian dish made of stacked layers of this flat pasta alternating with fillings such as ragù and other vegetables, cheese, and seasonings and spices such as garlic, oregano and basil."
Bibimbap,South Korea,2,"A Korean rice dish. The term 'bibim' means 'mixing' and 'bap' refers to cooked rice. It is served as a bowl of warm white rice topped with namul (sautéed and seasoned vegetables) and gochujang (chili pepper paste), soy sauce, or doenjang (a fermented soybean paste)."
Shawarma,Lebanon,1,"A Middle Eastern dish consisting of meat cut into thin slices, stacked in a cone-like shape, and roasted on a slowly-turning vertical rotisserie or spit."
Peking Duck,China,2,"A dish from Beijing (Peking) that has been prepared since the imperial era. The meat is characterized by its thin, crisp skin, with authentic versions of the dish serving mostly the skin and little meat, sliced in front of the diners by the cook."
Haggis,Scotland,3,"A savoury pudding containing sheep's pluck (heart, liver, and lungs); minced with onion, oatmeal, suet, spices, and salt, mixed with stock, traditionally encased in the animal's stomach though now often in an artificial casing instead."
Arepa,Venezuela,2,"A type of food made of ground maize dough, originating from the northern region of South America in pre-Columbian times, and is notable in the cuisines of Colombia and Venezuela."
Couscous,Morocco,2,A North African dish of small steamed balls of crushed durum wheat semolina that is traditionally served with a stew spooned on top.
Biryani,India,2,"A mixed rice dish originating among the Muslims of the Indian subcontinent. It is made with Indian spices, rice, and meat (chicken, beef, goat, pork, lamb, prawn, or fish), or vegetables and sometimes, in addition, eggs and/or potatoes."
Fajita,Mexico,1,"A term in Tex-Mex cuisine referring to any grilled meat that is usually served as a taco on a flour or corn tortilla."
Samosa,India,1,"A fried or baked pastry with a savoury filling, such as spiced potatoes, onions, peas, cheese, beef and other meats, or lentils. It may take different forms, including triangular, cone, or half-moon shapes, depending on the region."
Hummus,Middle East,1,"A Middle Eastern dip, spread, or savory dish made from cooked, mashed chickpeas blended with tahini, lemon juice, and garlic."
Picanha,Brazil,2,"A cut of beef first made popular in Brazil, and later adopted in Portugal. In the United States, the cut is little known and often named top sirloin cap, rump cover, rump cap, or culotte."
Kimchi,South Korea,1,"A traditional Korean side dish of salted and fermented vegetables, such as napa cabbage and Korean radish, made with a widely varying selection of seasonings including gochugaru (chili powder), scallions, garlic, ginger, and jeotgal (salted seafood), etc."
Bratwurst,Germany,1,"A type of German sausage made from veal, beef, or most commonly pork."
Doro Wat,Ethiopia,2,An Ethiopian chicken stew. It is one of the most popular and well-known of all Ethiopian dishes.
Baklava,Turkey,1,"A layered pastry dessert made of filo pastry, filled with chopped nuts, and sweetened with syrup or honey. It was one of the most popular sweet pastries of Ottoman cuisine."
Churros,Spain,1,"A strip of fried dough, sometimes filled, originating from Spain and Portugal."
Tiramisu,Italy,1,"A coffee-flavoured Italian dessert. It is made of ladyfingers (savoiardi) dipped in coffee, layered with a whipped mixture of eggs, sugar, and mascarpone cheese, flavoured with cocoa."
Gallo Pinto,Costa Rica,2,"A traditional dish from Central America. Consisting of rice and beans as a base, gallo pinto has a long history and is important to various Latin American cultures."
Wienerschnitzel,Austria,2,"A very thin, breaded and pan-fried cutlet made from veal. It is one of the best known specialities of Viennese cuisine, and one of the national dishes of Austria."
Moqueca,Brazil,2,A Brazilian seafood stew. It is slowly cooked in a terracotta cassole.
Shepherd's Pie,United Kingdom,2,"A ground meat pie with a crust or topping of mashed potato of English origin."
Nasi Goreng,Indonesia,2,"A Southeast Asian fried rice dish, usually cooked with pieces of meat and vegetables. One of Indonesia's national dishes."
Khachapuri,Georgia,2,"A traditional Georgian dish of cheese-filled bread. The bread is leavened and allowed to rise and is shaped in various ways, usually with cheese in the middle and a crust which is ripped off and used to dip in the cheese."
Falafel,Middle East,2,"A deep-fried ball, doughnut or patty made from ground chickpeas, fava beans, or both. Falafel is a traditional Middle Eastern food, that most likely originated in Egypt."
Papadum,India,2,"A thin, crisp, round flatbread from the Indian subcontinent. It is typically based on a seasoned dough usually made from peeled black gram flour (urad flour), either fried or cooked with dry heat."
Acarajé,Brazil,4,"A dish made from peeled beans formed into a ball and then deep-fried in dendê (palm oil). It is a street food in the Brazilian state of Bahia, especially in the city of Salvador."
Ropa Vieja,Cuba,3,"One of the national dishes of Cuba, consisting of shredded or pulled beef in a tomato-based sauce."
Bubble Tea,Taiwan,1,"A Taiwanese tea-based drink invented in Tainan and Taichung in the 1980s. Most bubble tea recipes contain a tea base mixed with fruit or milk, to which chewy tapioca balls and fruit jelly are often added."
Chili Con Carne,Mexico/United States,2,"A spicy stew containing chili peppers (sometimes in the form of chili powder), meat (usually beef), and often tomatoes and beans. Its origins are disputed, but it is generally thought to have originated in Texas."
Gyoza,Japan,1,A Japanese crescent-shaped dumpling. It is the Japanese version of the Chinese jiaozi.
Thieboudienne,Senegal,3,"A traditional dish from Senegal. It is a flavorful combination of fish, rice, and tomato sauce, and it is the national dish of Senegal."
Sachertorte,Austria,3,"A specific type of chocolate cake, or torte, invented by Austrian Franz Sacher in 1832 for Prince Metternich in Vienna, Austria. It is one of the most famous Viennese culinary specialities."
Dal Bhat,Nepal,2,"A traditional meal from the Indian subcontinent, popular in many areas of Nepal, Bangladesh and India. It consists of steamed rice and a cooked lentil soup called dal."
Cachupa,Cape Verde,3,"A famous dish from the Cape Verde islands, West Africa. It is a slow-cooked stew of corn (hominy), beans, cassava, sweet potato, fish or meat (sausage, beef, goat or chicken), and often morcela (blood sausage)."
Vindaloo,India,2,"An Indian curry dish popular in the region of Goa. The cuisine of the region is a mix of Indian and Portuguese influences."
Banitsa,Bulgaria,3,"A traditional Bulgarian food in the börek family prepared by layering a mixture of whisked eggs, natural yogurt and pieces of white brined cheese between filo pastry and then baking it in an oven."
Asado,Argentina,2,"The barbecue of a social event in Argentina and other South American countries. It is a traditional dish and also the standard word for 'barbecue'."
Pani Puri,India,2,"A type of snack that originated in the Indian subcontinent. It consists of a round, hollow puri, fried crisp and filled with a mixture of flavored water (known as imli pani), tamarind chutney, chili, chaat masala, potato, onion or chickpeas."
Pastel de Nata,Portugal,2,"A Portuguese egg tart pastry, common in Portugal, and in the Lusosphere."
Halo-Halo,Philippines,3,"A popular cold dessert in the Philippines made up of crushed ice, evaporated milk or condensed milk, and various ingredients including, ube, sweetened beans, coconut strips, sago, gulaman (seaweed gelatin), pinipig rice, boiled taro or soft yams in cubes, fruit slices, flan, and topped with a scoop of ice cream."
Dosa,India,2,"A thin pancake or crepe, originating from South India, made from a fermented batter predominantly consisting of lentils and rice."
Tagine,Morocco,3,"A North African dish which is named after the earthenware pot in which it is cooked."
Pão de Queijo,Brazil,3,"A small, baked cheese roll or cheese bun, a popular snack and breakfast food in Brazil."
Manti,Turkey,3,A type of dumpling popular in most Turkic cuisines, as well as in the cuisines of the South Caucasus, Central Asia, Afghanistan, Iran, Pakistan, Balkans, and China.
Dolmades,Greece,3,"A family of stuffed dishes common in the cuisines of the former Ottoman Empire and surrounding regions, including Turkey, Greece, Cyprus, Iran and the Caucasus."
Lumpia,Philippines,3,"A type of spring roll of Chinese origin commonly found in the Philippines and Indonesia."
Chicken Tikka Masala,United Kingdom/India,2,"A dish of roasted chunks of chicken tikka in a spicy sauce. The sauce is usually creamy and orange-coloured."
Chakalaka,South Africa,3,"A South African vegetable relish, usually spicy, that is traditionally served with bread, pap, samp, stews, or curries."
Sauerbraten,Germany,2,"A German pot roast that can be prepared with a variety of meats—most often beef, but also venison, lamb and mutton, pork and horse."
Roggenbrot,Germany,3,"A type of bread made with flour from the rye grain. It is typically denser than bread made from wheat flour."
Mochi,Japan,2,"A Japanese rice cake made of mochigome, a short-grain japonica glutinous rice, and sometimes other ingredients such as water, sugar, and cornstarch."
Fufu,Ghana,2,"A staple food common in many countries in West Africa and Central Africa made by boiling starchy food crops like cassava, yams or plantains and then pounding them into a dough-like consistency."
Aji de Gallina,Peru,3,"A Peruvian chicken stew. The dish is a popular Peruvian comfort food, and the name translates to 'chicken chili' or 'hen's chili' in English."
Escargots,France,2,"A dish consisting of cooked land snails. It is a delicacy in France and other countries."
Cannoli,Italy,2,"An Italian pastry dessert of the Sicily region. The singular is cannolo."
Jerky,United States,1,"Lean trimmed meat that has been cut into strips and dried (dehydrated) to prevent spoilage."
Tabbouleh,Lebanon,2,"A Levantine vegetarian salad made mostly of finely chopped parsley, with tomatoes, mint, onion, bulgur, and seasoned with olive oil, lemon juice, salt and pepper."
Pavlova,Australia/New Zealand,3,"A meringue-based dessert named after the Russian ballerina Anna Pavlova. It is a meringue dessert with a crisp crust and soft, light inside, usually topped with fruit and whipped cream."
Bún Chả,Vietnam,3,"A Vietnamese dish of grilled pork and noodle, which is thought to have originated from Hanoi, Vietnam."
Chilaquiles,Mexico,2,"A traditional Mexican dish. Typically, corn tortillas cut in quarters and lightly fried are the basis of the dish."
Sarawak Laksa,Malaysia,3,"A breakfast dish from the Malaysian state of Sarawak, on the island of Borneo. It is a coconut-based curry noodle soup."
Calzone,Italy,2,"An Italian oven-baked folded pizza, often described as a turnover, made with leavened dough."
Atole,Mexico,3,"A traditional hot corn- and masa-based beverage of Mexican and Central American origin."
Khachapuri Adjaruli,Georgia,3,"A boat-shaped version of khachapuri, a traditional Georgian cheese bread, with a raw egg added on top."
Bangers and Mash,Ireland,2,"A traditional British dish consisting of sausages served with mashed potatoes. It is a popular pub dish."
Lángos,Hungary,3,"A Hungarian food specialty, a deep-fried flatbread made of a dough with flour, yeast, salt and water."
Confit de Canard,France,3,"A French dish made with the leg of a duck. While it is made across France, it is seen as a specialty of Gascony."
Khao Phad,Thailand,2,A Thai-style fried rice dish.
Bánh Mì,Vietnam,2,"The Vietnamese word for bread. In Vietnamese cuisine, it also refers to a type of short baguette with thin, crisp crust and soft, airy texture inside that is often split lengthwise and filled with savory ingredients like a submarine sandwich and served as a meal."
Kottu Roti,Sri Lanka,3,"A Sri Lankan dish made from godamba roti and vegetables, egg and/or meat, and spices."
Chermoula,Tunisia,4,"A marinade and relish used in Algerian, Libyan, Moroccan and Tunisian cooking. It is traditionally used to flavor fish or seafood, but it can be used on other meats or vegetables."
Stoemp,Belgium,3,"A Belgian dish of pureed or mashed potatoes and other root vegetables, and can also include cream, bacon, onion or shallot, herbs, and spices."
Bacalhau à Brás,Portugal,3,"A Portuguese dish made from shreds of salted cod (bacalhau), onions and thinly chopped fried potatoes, all bound with scrambled eggs."
Plov,Uzbekistan,3,"A rice pilaf dish from Central Asia. In Uzbekistan, it is the national dish."
Sarma,Turkey,3,"A dish of grape, cabbage, monk's rhubarb, or chard leaves rolled around a filling of grains, minced meat, or both."
Rösti,Switzerland,3,"A Swiss dish consisting mainly of potatoes, in the style of a fritter. It was originally a breakfast dish, commonly eaten by farmers in the canton of Bern, but is now eaten all over Switzerland and around the world."
Adobo,Philippines,2,"A popular Filipino dish and cooking process in Filipino cuisine that involves meat, seafood, or vegetables marinated in vinegar, soy sauce, garlic, bay leaves, and black peppercorns, which is then browned in oil, and simmered in the marinade."
Tzatziki,Greece,2,"A dip, soup, or sauce found in the cuisines of Southeast Europe and the Middle East. It is made of salted strained yogurt or diluted yogurt mixed with cucumbers, garlic, salt, olive oil, sometimes with vinegar or lemon juice, and herbs such as dill, mint, parsley and thyme."
Kimchi Jjigae,South Korea,2,"A variety of jjigae, or stew-like Korean dish, made with kimchi and other ingredients, such as pork, scallions, onions, and diced tofu."
Sancocho,Colombia,3,"A traditional soup in several Latin American cuisines. It usually consists of large pieces of meat, tubers and vegetables served in a broth."
Maafe,Senegal,3,"A stew or sauce common to much of West Africa. It is a peanut-based stew."
Peking Roasted Duck,China,2,"A dish from Beijing (Peking) that has been prepared since the imperial era. The meat is characterized by its thin, crisp skin, with authentic versions of the dish serving mostly the skin and little meat, sliced in front of the diners by the cook."
Shakshuka,North Africa/Middle East,2,"A Maghrebi dish of eggs poached in a sauce of tomatoes, olive oil, peppers, onion and garlic, commonly spiced with cumin, paprika and cayenne pepper."
Vada Pav,India,3,"A vegetarian fast food dish native to the state of Maharashtra in India. It consists of a deep fried potato dumpling placed inside a bread bun (pav) sliced almost in half through the middle."
Açai Bowl,Brazil,2,"A Brazilian dish made of frozen and mashed açaí palm fruit. It is served as a smoothie in a bowl or glass, and is commonly topped with granola and banana, and then other fruits and guaraná syrup are added on top."
Escudella,Andorra,4,"A traditional Catalan and Andorran soup and stew. It is characterized by the use of a 'pilota', a very big meatball spiced with garlic and parsley."
Tavë Kosi,Albania,4,"A national dish in Albania. It is a dish of lamb and rice baked with a mixture of yogurt and eggs."
Tafelspitz,Austria,3,"A boiled beef dish, popular in Austria and the German state of Bavaria."
Yarpag Dolmasi,Azerbaijan,4,"A traditional Azerbaijani dish of stuffed vine leaves. The filling is a mixture of minced lamb, rice, and herbs."
Crack Conch,Bahamas,4,"A popular Bahamian dish made from conch, a type of sea snail. The conch is tenderized, breaded, and deep-fried."
Machboos,Bahrain,4,"A traditional Bahraini dish of spiced rice and meat (usually chicken or lamb). It is similar to biryani."
Riz Gras,Burkina Faso,4,"A traditional dish from Burkina Faso. It is a rice dish cooked in a tomato and onion sauce, often with meat or fish."
Mohinga,Myanmar,4,"A rice noodle and fish soup from Myanmar. It is an essential part of Burmese cuisine, and is considered by many to be the national dish."
Ndolé,Cameroon,4,"A Cameroonian dish consisting of stewed nuts, ndoleh (bitter leaves indigenous to West Africa), and fish or beef."
Cevapi,Bosnia and Herzegovina,3,"A grilled dish of minced meat found traditionally in the countries of southeast Europe (the Balkans). They are considered a national dish in Bosnia and Herzegovina and Serbia."
Peka,Croatia,4,"A traditional Croatian dish of meat or seafood and vegetables cooked under a bell-like lid covered in hot embers. It is a popular dish in the Dalmatia region."
Svíčková,Czech Republic,3,"A traditional Czech meat dish. It is a sirloin steak prepared with vegetables (carrots, parsley root, celeriac, and onion), spiced with black pepper, allspice, bay leaf, and thyme, and boiled with double cream. It is generally served with houskové knedlíky (bread dumplings)."
Skoudehkaris,Djibouti,4,"A traditional Djiboutian dish of rice and lamb. It is a one-pot meal, and is often served with a spicy sauce."
Qabili Palau,Afghanistan,3,"A variety of pilaf made in Afghanistan. It consists of steamed rice mixed with raisins, carrots, and beef or lamb."
Frikadeller,Denmark,3,"Flat, pan-fried meatballs of minced meat, often likened to the Danish version of meatballs. They are a popular dish in Denmark and other Nordic countries."
Chifrijo,Costa Rica,3,"A popular Costa Rican dish consisting of rice, beans, chicharrón (fried pork), and pico de gallo."
Bandera Nacional,Dominican Republic,3,"The national dish of the Dominican Republic. It consists of rice, red beans, and meat (beef, chicken, or pork)."
Kushari,Egypt,3,"An Egyptian dish of rice, macaroni, and lentils mixed together, topped with a spiced tomato sauce, and garlic vinegar; garnished with chickpeas and crispy fried onions."
Pupusa,El Salvador,3,"A traditional Salvadoran dish of a thick corn tortilla stuffed with a savory filling."
Doro Wet,Ethiopia,2,"An Ethiopian chicken stew. It is one of the most popular and well-known of all Ethiopian dishes."
Lovo,Fiji,4,"A traditional Fijian feast where food is cooked in an earth oven. A variety of meats, fish, and vegetables are wrapped in banana leaves and cooked for several hours."
Hernekeitto,Finland,4,"A traditional Finnish pea soup. It is usually served on Thursdays, and is often accompanied by pancakes for dessert."
Poulet Yassa,Guinea,3,"A spicy dish prepared with onions and either marinated poultry or marinated fish. Originally from Senegal, yassa has become popular throughout West Africa."
Pabellón Criollo,Venezuela,3,"A traditional Venezuelan dish, the local version of the rice and beans combination found throughout the Caribbean. It is a plate of rice, shredded beef in a stew, and stewed black beans."
Griot,Haiti,4,"A popular Haitian dish of fried pork. It is often served with pikliz (a spicy cabbage relish) and fried plantains."
Plato Típico,Honduras,3,"A traditional Honduran dish that typically includes grilled meat, fried plantains, rice, beans, and a salad."
Þorramatur,Iceland,4,"A selection of traditional Icelandic food, consisting mainly of meat and fish products cured in a traditional manner, cut into slices or pieces and served with rúgbrauð (dense and dark rye bread)."
Chelow Kabab,Iran,3,"The national dish of Iran. It is a dish of steamed, saffroned Persian rice and kabab."
Masgouf,Iraq,4,"A traditional Iraqi dish of grilled fish. The fish is slow-grilled for several hours after being marinated with tamarind, and is often served with rice, lemon, and pickles."
Irish Stew,Ireland,2,"A traditional Irish dish made from lamb or mutton, potatoes, onions, and parsley."
Jachnun,Yemen,4,"A traditional Yemenite Jewish pastry, served on Shabbat morning. It is prepared from rolled dough which is baked on very low heat for about ten hours."
Ossobuco alla Milanese,Italy,3,"A Milanese speciality of cross-cut veal shanks braised with vegetables, white wine and broth. It is often garnished with gremolata and traditionally served with either risotto alla milanese or polenta, depending on the regional variation."
Ackee and Saltfish,Jamaica,3,"The national dish of Jamaica. It is made from ackee and salted codfish."
Miso no Komi,Japan,3,"A type of udon noodle soup from the city of Nagoya in central Japan. The soup is flavored with miso, and typically contains chicken, a raw egg, and other ingredients."
Mansaf,Jordan,3,"A traditional Jordanian dish made of lamb cooked in a sauce of fermented dried yogurt and served with rice or bulgur."
Beshbarmak,Kazakhstan,4,"A traditional dish of Central Asian nomads. The term beshbarmak means 'five fingers' in the Turkic languages, because nomads traditionally eat this dish with their hands."
Ugali,Kenya,3,"A type of corn flour porridge made in Africa. It is a staple food in many African countries, and is often served with stews or other dishes."
Bulgogi,South Korea,2,"A gui (Korean-style grilled or roasted dish) made of thin, marinated slices of beef or pork grilled on a barbecue or on a stove-top griddle."
Majboos,Kuwait,4,"A traditional Kuwaiti dish of spiced rice and meat. It is similar to biryani."
Laghman,Kyrgyzstan,4,"A traditional Central Asian dish of pulled noodles, meat, and vegetables. It is popular in Kyrgyzstan, Kazakhstan, and Uzbekistan."
Larb,Laos,3,"A type of Lao meat salad that is regarded as the unofficial national dish of Laos. It is also eaten in the Isan region of Thailand, where the population is predominantly of Lao ethnicity."
Pīrāgs,Latvia,4,"A Latvian pastry, often consisting of a bread roll filled with a savory or sweet filling. It is a popular snack in Latvia."
