Food Name,Country of Origin,Rarity,Description
Rødgrød,Denmark,2,"A sweet fruit dish from Denmark and Northern Germany. The name of the dish in Danish literally means 'red porridge'."
Risotto,Italy,1,"A northern Italian rice dish cooked with broth until it reaches a creamy consistency."
Quiche,France,1,"A French tart consisting of pastry crust filled with savoury custard and pieces of cheese, meat, seafood or vegetables."
Pound Cake,United States,1,"A type of cake traditionally made with a pound of each of four ingredients: flour, butter, eggs, and sugar."
Potjevleesch,Belgium,3,"A traditional French Flemish dish, which can be translated into English as 'potted meat'. It is a cold dish of white meats in a savory jelly."
Pastilla,Morocco,3,"A North African meat or seafood pie made with warqa dough, which is similar to filo. It is a specialty of Morocco and Algeria."
Papas a la Huancaína,Peru,3,"A Peruvian appetizer of boiled yellow potatoes in a spicy, creamy sauce called Huancaína sauce."
Naan,India,1,"A leavened, oven-baked flatbread found in the cuisines mainly of West Asia, Central Asia, Southeast Asia, the Indian subcontinent and the Caribbean."
Miso Soup,Japan,1,"A traditional Japanese soup consisting of a dashi stock into which softened miso paste is mixed."
Milanesa,Argentina,2,"A South American variation of an Italian dish where generic types of breaded meat fillet preparations are known as a milanesa."
Mee Goreng,Indonesia,2,"A flavorful and spicy fried noodle dish common in Indonesia, Malaysia, and Singapore."
Marmita de Peixe,Portugal,3,"A Portuguese fish stew. It is a popular dish in the Algarve region."
Machaca,Mexico,3,"A dish of dried, shredded beef from Northern Mexico. It is a popular breakfast dish."
Khao Suey,Myanmar,3,"A Burmese noodle soup. It is a popular dish in Myanmar, and is often served for breakfast."
Khao tom,Thailand,2,"A Thai rice soup. It is a popular breakfast dish in Thailand."
Kartoflarka,Poland,3,"A Polish potato soup. It is a popular comfort food in Poland."
Karniyarik,Turkey,3,"A Turkish dish of stuffed eggplant. It is a popular dish in Turkey, and is often served as a main course."
Jambalaya,United States,2,"A popular dish of West African, French (especially Provençal), and Spanish influence, consisting mainly of meat and vegetables mixed with rice."
Hainanese Chicken Rice,Singapore,2,"A dish of poached chicken and seasoned rice, served with chili sauce and usually with cucumber garnishes. It was created by immigrants from Hainan in southern China and adapted from the Hainanese dish Wenchang chicken."
Gyros,Greece,2,"A Greek dish made from meat cooked on a vertical rotisserie. It is usually served in a pita bread with tomato, onion, and tzatziki sauce."
Frikadellen,Germany,2,"A German meatball. It is a popular dish in Germany, and is often served with potatoes and a sauce."
Enchilada,Mexico,2,"A corn tortilla rolled around a filling and covered with a savory sauce. Enchiladas can be filled with various ingredients, including meats, cheese, beans, potatoes, vegetables or combinations."
Ema Datshi,Bhutan,4,"A Bhutanese stew made from chili peppers and cheese. It is the national dish of Bhutan."
Cuy,Ecuador,4,"A guinea pig. It is a popular dish in the Andean regions of South America."
Cullen Skink,Scotland,3,"A thick Scottish soup made of smoked haddock, potatoes and onions. An authentic Cullen skink will use finnan haddie, but it may be prepared with any other undyed smoked haddock."
Changua,Colombia,3,"A Colombian milk soup. It is a popular breakfast dish in the Andean regions of Colombia."
Carbonara,Italy,2,"An Italian pasta dish from Rome made with eggs, hard cheese, cured pork, and black pepper."
Bacalhau à Gomes de Sá,Portugal,3,"A Portuguese dish of codfish, potatoes, eggs, and olives."
Bánh tét,Vietnam,3,"A Vietnamese savory but sometimes sweetened cake made from glutinous rice, which is rolled in a banana leaf into a thick, log-like cylindrical shape, with a mung bean or mung bean and pork filling, then boiled. After cooking, the banana leaf is removed and the cake is sliced into wheel-shaped servings."
Avgolemono,Greece,2,"A family of sauces and soups made with egg yolk and lemon juice mixed with broth, heated until they thicken. They are found in Greek, Arab, Sephardic Jewish, Turkish, Balkan and Italian cuisine."
Aloo Gobi,India,2,"A vegetarian dish from the Indian subcontinent made with potatoes (aloo), cauliflower (gobi), and Indian spices."
Adana Kebap,Turkey,2,"A long, hand-minced meat kebab mounted on a wide iron skewer and grilled on an open mangal filled with burning charcoal."